,#,Title,Acceptance,Difficulty,Frequency
0,124,Binary Tree Maximum Path Sum,36.8%,Hard,50
1,395,Longest Substring with At Least K Repeating Characters,44.2%,Medium,0
2,397,Integer Replacement,34.1%,Medium,0
3,410,Split Array Largest Sum,48.6%,Hard,100
4,413,Arithmetic Slices,61.3%,Medium,0
5,446,Arithmetic Slices II - Subsequence,38.9%,Hard,0
6,488,Zuma Game,37.6%,Hard,0
7,576,Out of Boundary Paths,39.7%,Medium,0
8,588,Design In-Memory File System,47.4%,Hard,0
9,873,Length of Longest Fibonacci Subsequence,48.4%,Medium,0
